

"RammStein","6wWVKhxIU2cEi0K81v7HvP","Rammstein is metal band from germany."
"Declan McKenna","2D4FOOOtWycb3Aw9nY5n3c","Declan Benedict McKenna is an English singer, songwriter, music producer, and political activist."
"queens of the stone age","4pejUc4iciQfgdX6OKulQn","Queens of the Stone Age (commonly abbreviated QOTSA) is an American rock band formed in 1996 in Palm Desert, California. "
"The white stripes","4F84IBURUo98rz4r61KF70","The White Stripes were an American rock duo from Detroit, Michigan formed in 1997."
"The happy fist","73rPcaYEhBd0UuVZBqqyQJ","Music band"
"Miracle Musical","2FRXiAz5Uz78LLLSwEUhLt","Miracle Musical is a musical project spearheaded by Joe Hawley, with Ross Federman and Bora Karaca co-ordinating and producing, and a multitude of other musicians and guests featuring."
"Royal Republic","0DbbnkFMhhDvinDYIiHhGS","Royal Republic is a Swedish rock band from Malmo."
"Queen","1dfeR4HaWDbWqFHLkxsg1d","Queen are a British rock band formed in London in 1970."
